### ISSUE TITLE
wrk does not stop when I stop the server 

### ISSUE THREAD

**Issue by takakawa** [wg/wrk#340]
I use wrk to benchmark my server,however when I shutdown my server,the wrk still continues to do some tcp-sync action .My screen is full of such tcpdumps.
```
14:46:24.175595 IP 10.189.8.37.25493 > 10.189.8.36.21268: Flags [S], seq 950226928, win 29200, options [mss 1460,sackOK,TS val 2663094126 ecr 0,nop,wscale 7], length 0
14:46:24.175602 IP 10.189.8.36.21268 > 10.189.8.37.25477: Flags [R.], seq 0, ack 14983720, win 0, length 0
14:46:24.175607 IP 10.189.8.37.25497 > 10.189.8.36.21268: Flags [S], seq 3471035189, win 29200, options [mss 1460,sackOK,TS val 2663094126 ecr 0,nop,wscale 7], length 0
14:46:24.175612 IP 10.189.8.37.25500 > 10.189.8.36.21268: Flags [S], seq 913141649, win 29200, options [mss 1460,sackOK,TS val 2663094126 ecr 0,nop,wscale 7], length 0
14:46:24.175618 IP 10.189.8.36.21268 > 10.189.8.37.25474: Flags [R.], seq 0, ack 9645981, win 0, length 0
14:46:24.175624 IP 10.189.8.36.21268 > 10.189.8.37.25493: Flags [R.], seq 0, ack 950226929, win 0, length 0
14:46:24.175630 IP 10.189.8.36.21268 > 10.189.8.37.25490: Flags [R.], seq 0, ack 9645794, win 0, length 0
14:46:24.175636 IP 10.189.8.37.25520 > 10.189.8.36.21268: Flags [S], seq 1786735568, win 29200, options [mss 1460,sackOK,TS val 2663094126 ecr 0,nop,wscale 7], length 0
14:46:24.175643 IP 10.189.8.37.25524 > 10.189.8.36.21268: Flags [S], seq 3629396400, win 29200, options [mss 1460,sackOK,TS val 2663094126 ecr 0,nop,wscale 7], length 0
14:46:24.175650 IP 10.189.8.36.21268 > 10.189.8.37.25516: Flags [R.], seq 0, ack 3834676209, win 0, length 0
14:46:24.175655 IP 10.189.8.36.21268 > 10.189.8.37.25471: Flags [R.], seq 0, ack 3393858449, win 0, length 0
14:46:24.175660 IP 10.189.8.36.21268 > 10.189.8.37.25518: Flags [R.], seq 0, ack 64048350, win 0, length 0
14:46:24.175666 IP 10.189.8.36.21268 > 10.189.8.37.25522: Flags [R.], seq 0, ack 13914764, win 0, length 0
14:46:24.175674 IP 10.189.8.36.21268 > 10.189.8.37.25502: Flags [R.], seq 0, ack 3257538175, win 0, length 0
```
I use ab to do the same test,ab stops just when i shutdown my server.Here prints the ab
```
Benchmarking 10.189.8.36 (be patient)
Completed 1000 requests
Completed 2000 requests
apr_socket_recv: Connection refused (111)
```

**Comment by wg** [comment]
This behavior is expected, wrk is designed to run until the end of the configured duration regardless of errors.
